<?xml version="1.0" encoding="UTF-8" ?>
<!-- 外联引入DTD文档约束 -->
<!DOCTYPE students SYSTEM './dtd/students.dtd'>
<students>
    <student>
        <id>001</id>
        <name>张三</name>
        <age>18</age>
        <book>
            <title>钢铁是怎样炼成的</title>
            <author>尼古拉·奥斯特洛夫斯基</author>
            <!-- <date>1933</date> -->
            <price>68</price>
            <booktag/>
        </book>
        <book>
            <title>朝花夕拾</title>
            <author>鲁迅</author>
            <date>1928</date>
            <!-- <price>35</price> -->
            <booktag/>
        </book>
        <score id="001" subject="数学" mark="99" pass="合格"/>
        <score id="002" subject="JAVA程序设计" mark="98" pass="合格"/>
    </student>
    <student attr="some_attr">
        <id>002</id>
        <name>李四</name>
        <age>19</age>
        <book>
            <title>围城</title>
            <author>钱钟书</author>
            <date>1946</date>
            <price>40</price>
            <booktag/>
        </book>
        <score id="003" mark="95" pass="合格" subject="学术英语"/>
    </student>
</students>